,image_id,image_url,image_desc,img_alt_desc
0,ae6_ENj2-sk,https://images.unsplash.com/photo-1518122480221-bd1bafb47460?ixlib=rb-1.2.1&q=80&fm=jpg&crop=entropy&cs=tinysrgb&w=400&fit=max&ixid=eyJhcHBfaWQiOjEyMDd9,,woman holding black bottle in rule of thirds photography
1,qGOADX9b3Hg,https://images.unsplash.com/photo-1441956012299-6de0ee8948bd?ixlib=rb-1.2.1&q=80&fm=jpg&crop=entropy&cs=tinysrgb&w=400&fit=max&ixid=eyJhcHBfaWQiOjEyMDd9,Food cutlery and beer,pasta with sauce on plate
2,5ndJiTw-yxg,https://images.unsplash.com/photo-1553825250-f01a48d7e159?ixlib=rb-1.2.1&q=80&fm=jpg&crop=entropy&cs=tinysrgb&w=400&fit=max&ixid=eyJhcHBfaWQiOjEyMDd9,,gray and red can on chair's arm
3,-V-ENAd192g,https://images.unsplash.com/photo-1491333078588-55b6733c7de6?ixlib=rb-1.2.1&q=80&fm=jpg&crop=entropy&cs=tinysrgb&w=400&fit=max&ixid=eyJhcHBfaWQiOjEyMDd9,"Small pub in Madrid, Spain, it felt really quaint and welcoming. I loved the atmosphere.","The interior of a bar with stools, glass cups and empty bottles attached to the roof in Madrid"
4,PXeN-BHbCYg,https://images.unsplash.com/photo-1452933006409-19b87dc327b7?ixlib=rb-1.2.1&q=80&fm=jpg&crop=entropy&cs=tinysrgb&w=400&fit=max&ixid=eyJhcHBfaWQiOjEyMDd9,A person walking by a poster,person walking near gray painted concrete wall
5,J3iadlhQ7qc,https://images.unsplash.com/photo-1488813857115-72630ec718ed?ixlib=rb-1.2.1&q=80&fm=jpg&crop=entropy&cs=tinysrgb&w=400&fit=max&ixid=eyJhcHBfaWQiOjEyMDd9,Table of wine and snacks,selective focus photo of plate with food beside glassware on table
6,rJPY9L2f_SM,https://images.unsplash.com/photo-1571250315503-ecb14720ad5d?ixlib=rb-1.2.1&q=80&fm=jpg&crop=entropy&cs=tinysrgb&w=400&fit=max&ixid=eyJhcHBfaWQiOjEyMDd9,,
7,IB5bld_weak,https://images.unsplash.com/photo-1484494789010-20fc1a011197?ixlib=rb-1.2.1&q=80&fm=jpg&crop=entropy&cs=tinysrgb&w=400&fit=max&ixid=eyJhcHBfaWQiOjEyMDd9,Man standing in a crowd,several people standing on field under blue sky
8,je3ugmcla3c,https://images.unsplash.com/photo-1524230476179-d13bcb5e3ce6?ixlib=rb-1.2.1&q=80&fm=jpg&crop=entropy&cs=tinysrgb&w=400&fit=max&ixid=eyJhcHBfaWQiOjEyMDd9,Smiles on Tap,male bartender
9,r8hw4Zs38zo,https://images.unsplash.com/photo-1470010762743-1fa2363f65ca?ixlib=rb-1.2.1&q=80&fm=jpg&crop=entropy&cs=tinysrgb&w=400&fit=max&ixid=eyJhcHBfaWQiOjEyMDd9,Hot stone bath in the mountains,man swimming in spring
10,wC7cLevB2Bw,https://images.unsplash.com/photo-1505004549772-f8b412f88d83?ixlib=rb-1.2.1&q=80&fm=jpg&crop=entropy&cs=tinysrgb&w=400&fit=max&ixid=eyJhcHBfaWQiOjEyMDd9,Bud light,man drinking beverage in amber glass bottle beside gray wire link fence at daytime
11,7BAaLjF-dWM,https://images.unsplash.com/photo-1485464546683-51e16d3ba6d2?ixlib=rb-1.2.1&q=80&fm=jpg&crop=entropy&cs=tinysrgb&w=400&fit=max&ixid=eyJhcHBfaWQiOjEyMDd9,Cheers,silhouette of person holding bottle during orange sunset
12,_09QLa5lWLo,https://images.unsplash.com/photo-1485269213802-81837d6ecac6?ixlib=rb-1.2.1&q=80&fm=jpg&crop=entropy&cs=tinysrgb&w=400&fit=max&ixid=eyJhcHBfaWQiOjEyMDd9,"We visited the The Nan Hua Temple in Bronkhorstspruit, South Africa during the Chinese New Year. The display was underway and I managed to squeeze myself into the front. There was a lot of competition for space from other photographers.

Luckily for me, someone else ventured a little bit further forward.",man wearing red shirt holding video camera
13,mjqaJiMkufY,https://images.unsplash.com/photo-1532635257-c526a9309b97?ixlib=rb-1.2.1&q=80&fm=jpg&crop=entropy&cs=tinysrgb&w=400&fit=max&ixid=eyJhcHBfaWQiOjEyMDd9,,man pouring liquid on bottle
14,nPNDrP3Ljms,https://images.unsplash.com/photo-1533264701333-1ebf1dacc05d?ixlib=rb-1.2.1&q=80&fm=jpg&crop=entropy&cs=tinysrgb&w=400&fit=max&ixid=eyJhcHBfaWQiOjEyMDd9,Local meetup decided to work away from their offices and instead at a local craft tap bar.,man sitting on red chair
15,IV4XVU2ipjA,https://images.unsplash.com/photo-1532635255-888592aa2f30?ixlib=rb-1.2.1&q=80&fm=jpg&crop=entropy&cs=tinysrgb&w=400&fit=max&ixid=eyJhcHBfaWQiOjEyMDd9,,selective photography of Veza Sur tray
16,6M-_autxECs,https://images.unsplash.com/photo-1497584062917-342aeed55fdf?ixlib=rb-1.2.1&q=80&fm=jpg&crop=entropy&cs=tinysrgb&w=400&fit=max&ixid=eyJhcHBfaWQiOjEyMDd9,Blonde woman on a boat,woman sitting on boat while floating on calm water at daytime
17,E6HjQaB7UEA,https://images.unsplash.com/photo-1466978913421-dad2ebd01d17?ixlib=rb-1.2.1&q=80&fm=jpg&crop=entropy&cs=tinysrgb&w=400&fit=max&ixid=eyJhcHBfaWQiOjEyMDd9,Friends eating lunch in diner,four person earring on black wooden table
18,ECIr9eYs3n4,https://images.unsplash.com/photo-1460752652228-71887ef91aa4?ixlib=rb-1.2.1&q=80&fm=jpg&crop=entropy&cs=tinysrgb&w=400&fit=max&ixid=eyJhcHBfaWQiOjEyMDd9,Skater Boy,ban sitting on gray ledge
19,5e8b_E8Skq4,https://images.unsplash.com/photo-1546781688-6da847f95e9c?ixlib=rb-1.2.1&q=80&fm=jpg&crop=entropy&cs=tinysrgb&w=400&fit=max&ixid=eyJhcHBfaWQiOjEyMDd9,,close-up photography of vehicle
20,ioZdKCEa_YI,https://images.unsplash.com/photo-1533638842865-579068d17afe?ixlib=rb-1.2.1&q=80&fm=jpg&crop=entropy&cs=tinysrgb&w=400&fit=max&ixid=eyJhcHBfaWQiOjEyMDd9,Nesse dia eu e minha esposa fomos visitar os famosos pastéis de Belém. No meio do caminho compramos uma cerveja artesanal muito boa por sinal com um vendedor local em uma carrocinha. Partimos para comprar nossos pastéis para fazer uma harmonização e deparamos com essa linda parede de  azulejos típicos de Lisboa.,woman standing near the wall while holding beer bottle
21,Nb_Q-M3Cdzg,https://images.unsplash.com/photo-1457460866886-40ef8d4b42a0?ixlib=rb-1.2.1&q=80&fm=jpg&crop=entropy&cs=tinysrgb&w=400&fit=max&ixid=eyJhcHBfaWQiOjEyMDd9,Hamburger with a beer,burger and fries on plate
22,C1fMH2Vej8A,https://images.unsplash.com/photo-1485963631004-f2f00b1d6606?ixlib=rb-1.2.1&q=80&fm=jpg&crop=entropy&cs=tinysrgb&w=400&fit=max&ixid=eyJhcHBfaWQiOjEyMDd9,"Pull out the beer. Grab the smoked cheddar. Your team is on TV and it’s high time we cheer. And by “cheer”, I mean “stuff our faces.” Obvs.","flat lay photography of sliced apples, sausages, chips and brown sauce"
23,aS7puomg6Oc,https://images.unsplash.com/photo-1480455550638-f32e7af53106?ixlib=rb-1.2.1&q=80&fm=jpg&crop=entropy&cs=tinysrgb&w=400&fit=max&ixid=eyJhcHBfaWQiOjEyMDd9,Man drinking a beer from,person holding glass cup while drinking
24,MD-PAjmHJSc,https://images.unsplash.com/photo-1496135137828-b0b35fc44608?ixlib=rb-1.2.1&q=80&fm=jpg&crop=entropy&cs=tinysrgb&w=400&fit=max&ixid=eyJhcHBfaWQiOjEyMDd9,Cheers mate,man in black tank top holding clear drinking glass
25,uxDQRHi4vfo,https://images.unsplash.com/photo-1508341103935-e8d7aa7d4815?ixlib=rb-1.2.1&q=80&fm=jpg&crop=entropy&cs=tinysrgb&w=400&fit=max&ixid=eyJhcHBfaWQiOjEyMDd9,just the two of us,woman and man holding drinking bottles
26,5FrM56BTITA,https://images.unsplash.com/photo-1517486140286-0b20c173d714?ixlib=rb-1.2.1&q=80&fm=jpg&crop=entropy&cs=tinysrgb&w=400&fit=max&ixid=eyJhcHBfaWQiOjEyMDd9,"I was recently moved to Madrid and I was sharing a flat with some German people. From my room’s window I saw a girl drinking a beer and I started to talk with her. I found her so interesting, and although I had know her that moment, I asked her if I could take a photo.",woman holding beer bottle on window
27,cMT0XOLr_4g,https://images.unsplash.com/photo-1532634778-ec5fa435f646?ixlib=rb-1.2.1&q=80&fm=jpg&crop=entropy&cs=tinysrgb&w=400&fit=max&ixid=eyJhcHBfaWQiOjEyMDd9,,man holding green leaf
28,6vkdx5nGevc,https://images.unsplash.com/photo-1547762015-11cd4d0b0c61?ixlib=rb-1.2.1&q=80&fm=jpg&crop=entropy&cs=tinysrgb&w=400&fit=max&ixid=eyJhcHBfaWQiOjEyMDd9,,man drinking in a bottle standing in the beach
29,s2ryvZkG1Rk,https://images.unsplash.com/photo-1533242553289-5ed0b2bc5a74?ixlib=rb-1.2.1&q=80&fm=jpg&crop=entropy&cs=tinysrgb&w=400&fit=max&ixid=eyJhcHBfaWQiOjEyMDd9,,Beer LED signboard
30,s2ryvZkG1Rk,https://images.unsplash.com/photo-1533242553289-5ed0b2bc5a74?ixlib=rb-1.2.1&q=80&fm=jpg&crop=entropy&cs=tinysrgb&w=400&fit=max&ixid=eyJhcHBfaWQiOjEyMDd9,,Beer LED signboard
31,lH4kUMxY6Y8,https://images.unsplash.com/photo-1491243658503-56c102aab1a9?ixlib=rb-1.2.1&q=80&fm=jpg&crop=entropy&cs=tinysrgb&w=400&fit=max&ixid=eyJhcHBfaWQiOjEyMDd9,People sitting and drinking,group of people on wooden dock during sunset in silhouette photography
32,Fb_PcY_PQgY,https://images.unsplash.com/photo-1532634931-f8ec541ea2aa?ixlib=rb-1.2.1&q=80&fm=jpg&crop=entropy&cs=tinysrgb&w=400&fit=max&ixid=eyJhcHBfaWQiOjEyMDd9,,stainless steel tanks
33,lxQGZHZ6UH4,https://images.unsplash.com/photo-1510836983402-bc0cd3bb1229?ixlib=rb-1.2.1&q=80&fm=jpg&crop=entropy&cs=tinysrgb&w=400&fit=max&ixid=eyJhcHBfaWQiOjEyMDd9,"We were on my friends farm, we took some beers and went to go check the sunset, and we decided to also just snap some pics in the process. Was a beautiful sunset BTW!",man wearing hoodie holding a bottle of beer
34,wcDru6t-aCg,https://images.unsplash.com/photo-1541544741938-0af808871cc0?ixlib=rb-1.2.1&q=80&fm=jpg&crop=entropy&cs=tinysrgb&w=400&fit=max&ixid=eyJhcHBfaWQiOjEyMDd9,,fries and meat on chopping board
35,Y2xG2-tGQGg,https://images.unsplash.com/photo-1510893265870-320979e20c42?ixlib=rb-1.2.1&q=80&fm=jpg&crop=entropy&cs=tinysrgb&w=400&fit=max&ixid=eyJhcHBfaWQiOjEyMDd9,hello?,man using smartphone standing in front on beverage cooler inside store
36,uT9TuNtLjlQ,https://images.unsplash.com/photo-1517359667188-dc53bf7c4c5d?ixlib=rb-1.2.1&q=80&fm=jpg&crop=entropy&cs=tinysrgb&w=400&fit=max&ixid=eyJhcHBfaWQiOjEyMDd9,,man and woman sitting on Kaffe Perro Negro patio
37,C24wahJxekk,https://images.unsplash.com/photo-1532635247-e80765ae2157?ixlib=rb-1.2.1&q=80&fm=jpg&crop=entropy&cs=tinysrgb&w=400&fit=max&ixid=eyJhcHBfaWQiOjEyMDd9,,four women holding drinking cups during daytime
38,46AoazNXpcE,https://images.unsplash.com/photo-1531173388836-4dfa46e4beed?ixlib=rb-1.2.1&q=80&fm=jpg&crop=entropy&cs=tinysrgb&w=400&fit=max&ixid=eyJhcHBfaWQiOjEyMDd9,"This is a photo of a rock on Beer beach, taken in the blue hour to achieve the blue effect of the photo.",long exposure photography body of water
39,8gBBHX_SqMo,https://images.unsplash.com/photo-1527169402691-feff5539e52c?ixlib=rb-1.2.1&q=80&fm=jpg&crop=entropy&cs=tinysrgb&w=400&fit=max&ixid=eyJhcHBfaWQiOjEyMDd9,Sometimes simple things are the best things… enjoy a beer with friends.,sliced cheese beside nuts
40,15afpOHJilU,https://images.unsplash.com/photo-1500757045557-7864506cf31c?ixlib=rb-1.2.1&q=80&fm=jpg&crop=entropy&cs=tinysrgb&w=400&fit=max&ixid=eyJhcHBfaWQiOjEyMDd9,Live it up.,man seating beside buildings
41,p5HI4AimSkk,https://images.unsplash.com/photo-1519311513095-ec90ca778d2c?ixlib=rb-1.2.1&q=80&fm=jpg&crop=entropy&cs=tinysrgb&w=400&fit=max&ixid=eyJhcHBfaWQiOjEyMDd9,Parkeando en el casco de la ciudad de Panamá tomando unas buenas cervezas.,flat-lay photography of empty pint glasses on top of brown wooden slatted table
42,ok6_RIU31rQ,https://images.unsplash.com/photo-1510853690125-8b66e84b299a?ixlib=rb-1.2.1&q=80&fm=jpg&crop=entropy&cs=tinysrgb&w=400&fit=max&ixid=eyJhcHBfaWQiOjEyMDd9,,man drinking beer in can with man during daytime
43,2a4cpGaJDvU,https://images.unsplash.com/photo-1484582872607-a742b5da43a5?ixlib=rb-1.2.1&q=80&fm=jpg&crop=entropy&cs=tinysrgb&w=400&fit=max&ixid=eyJhcHBfaWQiOjEyMDd9,Mirror image of an alcohol store sign,Beer Wine Mimosa sticker
44,fhRJEG56Z8Q,https://images.unsplash.com/photo-1532719880791-ea2b56fdfa87?ixlib=rb-1.2.1&q=80&fm=jpg&crop=entropy&cs=tinysrgb&w=400&fit=max&ixid=eyJhcHBfaWQiOjEyMDd9,,clear glass beer mug on wooden board
45,jZFNmOfznFg,https://images.unsplash.com/photo-1567066245520-e8298259dd26?ixlib=rb-1.2.1&q=80&fm=jpg&crop=entropy&cs=tinysrgb&w=400&fit=max&ixid=eyJhcHBfaWQiOjEyMDd9,muzic festival times,woman in white sleeveless top
46,nJUuFfo79wI,https://images.unsplash.com/photo-1448997999437-3cb667cf2085?ixlib=rb-1.2.1&q=80&fm=jpg&crop=entropy&cs=tinysrgb&w=400&fit=max&ixid=eyJhcHBfaWQiOjEyMDd9,Hamburger with a beer,burger placed on grey bowl near beer bottle
47,UFXW3lisjWk,https://images.unsplash.com/photo-1549500665-ecfc1255261f?ixlib=rb-1.2.1&q=80&fm=jpg&crop=entropy&cs=tinysrgb&w=400&fit=max&ixid=eyJhcHBfaWQiOjEyMDd9,,closed door shutter door
48,PoAC9dCnofk,https://images.unsplash.com/photo-1541693948735-0509c9133c35?ixlib=rb-1.2.1&q=80&fm=jpg&crop=entropy&cs=tinysrgb&w=400&fit=max&ixid=eyJhcHBfaWQiOjEyMDd9,Beautiful Beers,black framed commercial beverage cooler with bottles
49,9RLk3ZpulUk,https://images.unsplash.com/photo-1513309914637-65c20a5962e1?ixlib=rb-1.2.1&q=80&fm=jpg&crop=entropy&cs=tinysrgb&w=400&fit=max&ixid=eyJhcHBfaWQiOjEyMDd9,www.outdoorjunkiez.com,people cheering while holding mugs
50,BPqMVBIZcBM,https://images.unsplash.com/photo-1504095649265-b37198e9c711?ixlib=rb-1.2.1&q=80&fm=jpg&crop=entropy&cs=tinysrgb&w=400&fit=max&ixid=eyJhcHBfaWQiOjEyMDd9,I saw these two man having lunch at a nice small bar in the city of Utrecht.,two men sitting on chair front of table
51,BC49M6wl--8,https://images.unsplash.com/46/M1IHnsfYRz2ThTgzl6qz_canyousea.jpg?ixlib=rb-1.2.1&q=80&fm=jpg&crop=entropy&cs=tinysrgb&w=400&fit=max&ixid=eyJhcHBfaWQiOjEyMDd9,Women Sunbathing on Beach,brown glass bottle across two women
52,8rweOOOKkno,https://images.unsplash.com/photo-1525705235800-a0c174299118?ixlib=rb-1.2.1&q=80&fm=jpg&crop=entropy&cs=tinysrgb&w=400&fit=max&ixid=eyJhcHBfaWQiOjEyMDd9,Thirsty? Ask for a beer!,two clear glass vases with text overlay
53,hWJeh6e_N7U,https://images.unsplash.com/photo-1561429642-20b1d2fb1177?ixlib=rb-1.2.1&q=80&fm=jpg&crop=entropy&cs=tinysrgb&w=400&fit=max&ixid=eyJhcHBfaWQiOjEyMDd9,,man holding book
54,RLsSeG9KzL0,https://images.unsplash.com/photo-1524109778675-a86c515079cb?ixlib=rb-1.2.1&q=80&fm=jpg&crop=entropy&cs=tinysrgb&w=400&fit=max&ixid=eyJhcHBfaWQiOjEyMDd9,Man in the bar,greyscale photo of man sitting while reading newspaper
55,pxypbW-UXJo,https://images.unsplash.com/photo-1559758371-87c0985e2364?ixlib=rb-1.2.1&q=80&fm=jpg&crop=entropy&cs=tinysrgb&w=400&fit=max&ixid=eyJhcHBfaWQiOjEyMDd9,,woman wearing white tank top
56,wYOPqmtDD0w,https://images.unsplash.com/photo-1533777419517-3e4017e2e15a?ixlib=rb-1.2.1&q=80&fm=jpg&crop=entropy&cs=tinysrgb&w=400&fit=max&ixid=eyJhcHBfaWQiOjEyMDd9,las4estaciones,three people having a toast on table
57,GCnLRR9Kde4,https://images.unsplash.com/photo-1560091296-3cce7fe4b2d2?ixlib=rb-1.2.1&q=80&fm=jpg&crop=entropy&cs=tinysrgb&w=400&fit=max&ixid=eyJhcHBfaWQiOjEyMDd9,,woman sitting beside window while looking outside
58,t7B38zOuaKk,https://images.unsplash.com/photo-1496397604916-a3d9461942b6?ixlib=rb-1.2.1&q=80&fm=jpg&crop=entropy&cs=tinysrgb&w=400&fit=max&ixid=eyJhcHBfaWQiOjEyMDd9,"slow sips until the glass is empty and we can continue our spiritual journey for answers. Understand though, the answers never hide inside of a bottle but freeing your mind of constrains will help you in your quest for happiness.",woman sipping beverage on drinking glasses indoors
59,okBa2fFynvs,https://images.unsplash.com/photo-1517562652858-8d863a9e0931?ixlib=rb-1.2.1&q=80&fm=jpg&crop=entropy&cs=tinysrgb&w=400&fit=max&ixid=eyJhcHBfaWQiOjEyMDd9,Pub life,blue van on brown wooden shelf
60,x3XldU0M-lc,https://images.unsplash.com/photo-1559758371-629e85e8b175?ixlib=rb-1.2.1&q=80&fm=jpg&crop=entropy&cs=tinysrgb&w=400&fit=max&ixid=eyJhcHBfaWQiOjEyMDd9,,grayscale photography of group of person standing outdoors
61,9UYB1nlxUXY,https://images.unsplash.com/photo-1531425032538-97d0fe49235f?ixlib=rb-1.2.1&q=80&fm=jpg&crop=entropy&cs=tinysrgb&w=400&fit=max&ixid=eyJhcHBfaWQiOjEyMDd9,"I’ve always been passionate about shooting the Milky Way and when I found out it was possible just a 5 min walk from my house, I was amazed. Shame I don’t have a camera that can deal with high ISO’s but you got to work with what you got!",person holding LED light
62,1gqXSOOH5cs,https://images.unsplash.com/photo-1532635278-872c8b2b3efe?ixlib=rb-1.2.1&q=80&fm=jpg&crop=entropy&cs=tinysrgb&w=400&fit=max&ixid=eyJhcHBfaWQiOjEyMDd9,,four women sitting beside pool
63,mj54JPQpF8M,https://images.unsplash.com/photo-1504963642567-227b3bbd79de?ixlib=rb-1.2.1&q=80&fm=jpg&crop=entropy&cs=tinysrgb&w=400&fit=max&ixid=eyJhcHBfaWQiOjEyMDd9,,books on table near bottle and leaf plant in pot
64,Llm60DM-m6A,https://images.unsplash.com/photo-1470405696369-2ab23def9f8d?ixlib=rb-1.2.1&q=80&fm=jpg&crop=entropy&cs=tinysrgb&w=400&fit=max&ixid=eyJhcHBfaWQiOjEyMDd9,Vintage record store,man holding a bottle
65,nTReGBsk7rk,https://images.unsplash.com/photo-1532635260-3db6e1ba8589?ixlib=rb-1.2.1&q=80&fm=jpg&crop=entropy&cs=tinysrgb&w=400&fit=max&ixid=eyJhcHBfaWQiOjEyMDd9,,shallow focus photography of man refilling bottle
66,2FNIy7U3UC0,https://images.unsplash.com/photo-1539258769975-98257f9e7ca4?ixlib=rb-1.2.1&q=80&fm=jpg&crop=entropy&cs=tinysrgb&w=400&fit=max&ixid=eyJhcHBfaWQiOjEyMDd9,"Beer is a small fishing village located in East Devon on the Jurassic Coast. With the fishing boats sitting right on the beach, it’s a great place to find colour even on the most overcast of days.",two blue and black boats on seashore under cloudy sky
67,ab5cYksljk0,https://images.unsplash.com/photo-1524137224090-114639b09a84?ixlib=rb-1.2.1&q=80&fm=jpg&crop=entropy&cs=tinysrgb&w=400&fit=max&ixid=eyJhcHBfaWQiOjEyMDd9,Finer Things,person about to cook food
68,uv2Q_agOpRU,https://images.unsplash.com/photo-1508061501437-e1b984a4d665?ixlib=rb-1.2.1&q=80&fm=jpg&crop=entropy&cs=tinysrgb&w=400&fit=max&ixid=eyJhcHBfaWQiOjEyMDd9,,broken green glass bottle on the ground
69,7YIj4j6V0m0,https://images.unsplash.com/photo-1550874648-dc29fc3b4307?ixlib=rb-1.2.1&q=80&fm=jpg&crop=entropy&cs=tinysrgb&w=400&fit=max&ixid=eyJhcHBfaWQiOjEyMDd9,,man kneeling beside river
70,0bRWxm_ALzA,https://images.unsplash.com/photo-1527624318231-7a3ee5c535f3?ixlib=rb-1.2.1&q=80&fm=jpg&crop=entropy&cs=tinysrgb&w=400&fit=max&ixid=eyJhcHBfaWQiOjEyMDd9,It’s party time,black-and-white can lot
71,tHQgs-ac9lo,https://images.unsplash.com/photo-1536687410384-91830e127b73?ixlib=rb-1.2.1&q=80&fm=jpg&crop=entropy&cs=tinysrgb&w=400&fit=max&ixid=eyJhcHBfaWQiOjEyMDd9,Bud Light,Bud Light neon signage turned-on
72,yKH2gsVK-xo,https://images.unsplash.com/photo-1489365952375-409e2283dc22?ixlib=rb-1.2.1&q=80&fm=jpg&crop=entropy&cs=tinysrgb&w=400&fit=max&ixid=eyJhcHBfaWQiOjEyMDd9,Spectator in bobble hat at the Yankee stadium,person sitting while facing on green field
73,fsrwYDW6JpM,https://images.unsplash.com/photo-1517091869083-a411d638c435?ixlib=rb-1.2.1&q=80&fm=jpg&crop=entropy&cs=tinysrgb&w=400&fit=max&ixid=eyJhcHBfaWQiOjEyMDd9,,"blue, yellow, and red Craft Beer lighted signage"
74,N1Mp0hvnUUI,https://images.unsplash.com/photo-1473178171362-c7a560dc2971?ixlib=rb-1.2.1&q=80&fm=jpg&crop=entropy&cs=tinysrgb&w=400&fit=max&ixid=eyJhcHBfaWQiOjEyMDd9,Beer inside a rusty old boat.,beer can on brown boat with ropes
75,3XTaTN0HRSw,https://images.unsplash.com/photo-1436076879760-817e51341b15?ixlib=rb-1.2.1&q=80&fm=jpg&crop=entropy&cs=tinysrgb&w=400&fit=max&ixid=eyJhcHBfaWQiOjEyMDd9,Man throwing a beer,silhouette photo of two men throwing bottle during daytime
76,S3iBRUzLuEE,https://images.unsplash.com/photo-1524149126057-f010534cf95e?ixlib=rb-1.2.1&q=80&fm=jpg&crop=entropy&cs=tinysrgb&w=400&fit=max&ixid=eyJhcHBfaWQiOjEyMDd9,,bottles hanged on hand rails
77,F2M41_8zmmA,https://images.unsplash.com/photo-1500840922267-8ff91fbf85aa?ixlib=rb-1.2.1&q=80&fm=jpg&crop=entropy&cs=tinysrgb&w=400&fit=max&ixid=eyJhcHBfaWQiOjEyMDd9,"Snapped a photo of a friend cooking everyone dinner during out cottage get-a-way. This was after a long day of sitting on the beach, playing volleyball, and drinking ourselves a little silly.",person cooking burger on gas grill
78,KiXr0ycdYsI,https://images.unsplash.com/photo-1526866428207-a2ffb7d82586?ixlib=rb-1.2.1&q=80&fm=jpg&crop=entropy&cs=tinysrgb&w=400&fit=max&ixid=eyJhcHBfaWQiOjEyMDd9,Hanging out with Cocksy for a couple of beers to catch up on good times!,man smiling while taking photo
79,Rqlm4FhofaM,https://images.unsplash.com/photo-1522997169209-1629f3f89fdf?ixlib=rb-1.2.1&q=80&fm=jpg&crop=entropy&cs=tinysrgb&w=400&fit=max&ixid=eyJhcHBfaWQiOjEyMDd9,,beer can lot with ice cube
80,wvOka1hCv24,https://images.unsplash.com/photo-1551651933-546ff2a04f31?ixlib=rb-1.2.1&q=80&fm=jpg&crop=entropy&cs=tinysrgb&w=400&fit=max&ixid=eyJhcHBfaWQiOjEyMDd9,,two men sitting on chairs
81,Y66R-ZKMvZU,https://images.unsplash.com/photo-1519040364483-542d88b34646?ixlib=rb-1.2.1&q=80&fm=jpg&crop=entropy&cs=tinysrgb&w=400&fit=max&ixid=eyJhcHBfaWQiOjEyMDd9,,man drinking on bottle under sunny sky
82,BcdrCuTayYk,https://images.unsplash.com/photo-1534265812669-c774e37a4ac3?ixlib=rb-1.2.1&q=80&fm=jpg&crop=entropy&cs=tinysrgb&w=400&fit=max&ixid=eyJhcHBfaWQiOjEyMDd9,,man holding hair dreadlocks hair of other man
83,q0duLlcH2ng,https://images.unsplash.com/photo-1522124633533-b3f7e37452f3?ixlib=rb-1.2.1&q=80&fm=jpg&crop=entropy&cs=tinysrgb&w=400&fit=max&ixid=eyJhcHBfaWQiOjEyMDd9,,brown glass bottles
84,3Tw0SETRCps,https://images.unsplash.com/photo-1559318957-3f8f59d27e06?ixlib=rb-1.2.1&q=80&fm=jpg&crop=entropy&cs=tinysrgb&w=400&fit=max&ixid=eyJhcHBfaWQiOjEyMDd9,,grayscale photography of couple sits by the window
85,BWnHYb6kZAA,https://images.unsplash.com/photo-1496880112349-9f0778ad2fb9?ixlib=rb-1.2.1&q=80&fm=jpg&crop=entropy&cs=tinysrgb&w=400&fit=max&ixid=eyJhcHBfaWQiOjEyMDd9,A woman sitting and drinking,man sitting on car's tail looking at ranch
86,rXBwosfgG-c,https://images.unsplash.com/photo-1511963118349-e2b22c0efcfc?ixlib=rb-1.2.1&q=80&fm=jpg&crop=entropy&cs=tinysrgb&w=400&fit=max&ixid=eyJhcHBfaWQiOjEyMDd9,,craft neon signage at nighttime
87,ceuXFBrb3zA,https://images.unsplash.com/photo-1516352254823-8fce5b3d7ec2?ixlib=rb-1.2.1&q=80&fm=jpg&crop=entropy&cs=tinysrgb&w=400&fit=max&ixid=eyJhcHBfaWQiOjEyMDd9,,woman standing inside bar
